question,response
Which MRIWA reports relate to mining extraction?,"## MRIWA Reports Related to Mining Extraction

The Minerals Research Institute of Western Australia (MRIWA) has been involved in various research initiatives that focus on mining extraction and related processes. Here are some key reports that highlight their contributions to this field:

### 1. MRIWA Report No. 488
This report details research findings on fluid-rock interactions and the behavior of lixiviants and oxidants for metal recovery from deep ore bodies. It provides insights into the mechanisms that can enhance extraction processes, particularly in challenging geological settings [Data: Reports (23756)].

### 2. MRIWA Report M532
This comprehensive publication discusses the geology, mineralogy, and geometallurgy of electric vehicle (EV) materials deposits in Western Australia. It contributes significantly to understanding these valuable resources and their potential applications in mining extraction technologies [Data: Reports (14450)].

### 3. MRIWA Project M0488
This project focuses on the application of in-situ recovery (ISR) techniques to primary copper sulfides, aiming to improve extraction methods for deep ore deposits. The findings from this project are crucial for advancing extraction technologies in the mining sector [Data: Reports (23770)].

### 4. Sequential Leaching Project M432
This project evaluates and validates mine waste management practices, which are essential for optimizing extraction processes and minimizing environmental impacts. The final report from this project provides valuable data on heavy metal risks and mineral extraction research [Data: Reports (13477)].

### 5. MRIWA Project M459-M484
This series of research projects explores the potential of magmatic sulfide minerals in the East Kimberley region. The findings contribute to understanding the extraction potential of these minerals, which are significant for the mining industry [Data: Reports (16808)].

These reports collectively enhance the understanding of mining extraction processes and contribute to the development of more efficient and sustainable mining practices in Western Australia. The collaboration between MRIWA and various research entities underscores the importance of ongoing research in this critical sector [Data: Relationships (612, 633, 619)]."
Which regions of Western Australia are referenced in the MRIWA reports?,"## Regions of Western Australia Referenced in MRIWA Reports

The MRIWA (Minerals Research Institute of Western Australia) reports reference several significant regions within Western Australia, each contributing to various research initiatives and environmental assessments. Here are the key regions highlighted in the reports:

### 1. **Perth and Peel Regions**
The Perth and Peel regions are recognized for their substantial environmental values and potential for future growth. These areas are subject to strategic assessments aimed at preserving unique ecosystems and are characterized by sandy soils that influence land use and agricultural practices [Data: Entities (13249); Entities (5)].

### 2. **Fairbridge Duplex**
Fairbridge Duplex is specifically mentioned as a site where MRIWA conducts soil analysis and research. This location is integral to the environmental assessments related to the By-products (LEAF) Project M451 [Data: Relationships (625)].

### 3. **Bassendean Ellenbrook**
The Bassendean Ellenbrook area is another significant site for the By-products (LEAF) Project M451, where various environmental studies are conducted to assess soil and sediment management [Data: Relationships (626)].

### 4. **Swan Coastal Plain**
The Swan Coastal Plain is highlighted as a region of ecological importance, where various projects focus on environmental impact assessments and regulatory frameworks for industrial by-products [Data: Entities (27)].

### 5. **Boddington Area**
The Boddington area is referenced in relation to geological studies, particularly concerning the dating of geological formations, which contributes to the understanding of mineralization events [Data: Entities (102)].

### Conclusion
These regions are pivotal to the research and development efforts of MRIWA, focusing on environmental management, mineral resource assessment, and sustainability initiatives. The diverse geographical characteristics of these areas enhance the relevance of the research conducted, ensuring that it addresses local environmental and geological dynamics effectively. 

Overall, the integration of these regions into MRIWA's projects underscores the organization's commitment to advancing mineral research while considering the ecological implications of mining and resource management in Western Australia [Data: Reports (3709); Entities (25)]."
Which MRIWA report is related to the East Kimberley region?,"## MRIWA Report Related to the East Kimberley Region

The MRIWA report specifically related to the East Kimberley region is **MRIWA Report M459 - M484**. This report focuses on the magmatic sulfide mineral potential in the East Kimberley area, detailing research findings from projects aimed at exploring the geological features and mineral resources of this significant region in Western Australia. The report was authored by a team of researchers including Margaux Le Vaillant, Steve J. Barnes, and Marco L. Fiorentini, among others, and was distributed by the Minerals Research Institute of Western Australia (MRIWA) [Data: Sources (6989); Relationships (29808)]. 

The East Kimberley region is known for its rich geological features and mineral potential, particularly concerning magmatic sulfide minerals, which are critical for various mining and resource extraction activities. The findings from this report contribute to a better understanding of the mineralization processes and the overall geological landscape of the area, making it a valuable resource for both academic research and industry stakeholders [Data: Sources (6989)]. 

Overall, MRIWA Report M459 - M484 serves as a significant document for those interested in the mineral exploration and geological studies within the East Kimberley region, highlighting the ongoing research efforts and the potential for future resource development in this area."
